{
  "name": "analytics-dashboard",
  "version": "1.0.0",
  "description": "Oracle - Seer of patterns and foresight. Provides comprehensive analytics including velocity tracking, burndown charts, cost analysis, forecasting, and team performance metrics. Integrates with Jira for sprint analytics and GitHub for development metrics.",
  "author": {
    "name": "The Lobbi",
    "email": "developers@thelobbi.io"
  },
  "license": "MIT",
  "repository": "https://github.com/Lobbi-Docs/claude",
  "keywords": [
    "analytics", "metrics", "dashboard", "velocity", "burndown",
    "forecasting", "trends", "kpi", "performance", "productivity",
    "cost-analysis", "time-tracking", "sprint-metrics", "cycle-time",
    "lead-time", "throughput", "dora-metrics", "four-keys"
  ]
}
