{
  "name": "customer-data-migration-orchestrator",
  "version": "2.0.0",
  "description": "Terraformer - Universal data migration platform with source adapters. Like Terraform for infrastructure, but for customer data. Connect ANY source (Salesforce, HubSpot, Stripe, legacy DBs, CSVs) and automatically transform to YOUR target schema.",
  "author": {
    "name": "Lobbi Engineering",
    "email": "plugins@thelobbi.io"
  },
  "license": "MIT",
  "repository": "https://github.com/Lobbi-Docs/claude"
}
