{
  "name": "cognitive-code-reasoner",
  "version": "1.0.0",
  "description": "Didact - The Teacher of deep understanding. Revolutionary debugging and code analysis using extended thinking and multi-step cognitive reasoning. Employs hypothesis-driven debugging, causal chain analysis, temporal state reconstruction, and emergent bug pattern detection. Thinks like a senior engineer investigating complex production incidents.",
  "author": {
    "name": "The Lobbi",
    "email": "developers@thelobbi.io"
  },
  "license": "MIT",
  "repository": "https://github.com/Lobbi-Docs/claude",
  "keywords": [
    "extended-thinking", "ultrathink", "cognitive", "reasoning",
    "hypothesis-driven", "causal-analysis", "root-cause", "debugging",
    "temporal-reasoning", "state-reconstruction", "emergent-patterns",
    "multi-step-reasoning", "chain-of-thought", "tree-of-thought",
    "abductive-reasoning", "counterfactual", "invariant-analysis"
  ]
}
