{
  "name": "testforge",
  "version": "1.0.0",
  "description": "TestForge - Master of quality assurance through intelligent test generation. Analyzes code behavior to auto-generate comprehensive tests that catch real bugs, not just boost coverage numbers. Supports Jest, Pytest, Vitest, and more.",
  "author": {
    "name": "The Lobbi",
    "email": "developers@thelobbi.io"
  },
  "license": "MIT",
  "repository": "https://github.com/Lobbi-Docs/claude",
  "keywords": [
    "test-generation", "auto-test", "unit-test", "integration-test",
    "jest", "pytest", "vitest", "mocha", "jasmine",
    "mock-generation", "stub", "fixture", "test-double",
    "edge-cases", "boundary-testing", "mutation-testing",
    "coverage", "test-coverage", "coverage-gap",
    "tdd", "test-driven", "behavior-testing",
    "assertion", "test-data", "factory-pattern",
    "regression-prevention", "bug-detection", "quality"
  ]
}
