{
  "name": "notification-hub",
  "version": "1.0.0",
  "description": "Messenger - Voice across dimensions. Unified notification orchestration for Slack, Microsoft Teams, Discord, Email, and Webhooks. Manages approval workflows, escalation chains, and intelligent notification routing with digest and priority management.",
  "author": {
    "name": "The Lobbi",
    "email": "developers@thelobbi.io"
  },
  "license": "MIT",
  "repository": "https://github.com/Lobbi-Docs/claude",
  "keywords": [
    "notifications", "slack", "teams", "discord", "email",
    "webhooks", "alerts", "approvals", "escalation", "routing",
    "digest", "priority", "mute", "channels", "mentions",
    "on-call", "pagerduty", "opsgenie", "incident"
  ]
}
