{
  "name": "release-orchestrator",
  "version": "1.0.0",
  "description": "Herald - Announcer of new horizons. Orchestrates the complete release lifecycle including semantic versioning, changelog generation, release notes, deployment coordination, rollback management, and feature flag integration. Integrates with Jira for release tracking and GitHub for automated releases.",
  "author": {
    "name": "The Lobbi",
    "email": "developers@thelobbi.io"
  },
  "license": "MIT",
  "repository": "https://github.com/Lobbi-Docs/claude",
  "keywords": [
    "release", "versioning", "semantic-version", "semver",
    "changelog", "release-notes", "deployment", "rollback",
    "feature-flags", "canary", "blue-green", "rolling-update",
    "tag", "github-release", "npm-publish", "docker-tag",
    "hotfix", "patch", "major", "minor"
  ]
}
