{
  "name": "multi-model-orchestration",
  "version": "1.0.0",
  "description": "Conductor - The Orchestrator of Intelligences. Revolutionary multi-LLM orchestration that dynamically routes tasks to the optimal AI model (Claude, GPT, Gemini, Llama, Mistral) based on task characteristics, cost, latency, and capability matching. Implements model ensembles, consensus voting, and specialized model routing for maximum effectiveness.",
  "author": {
    "name": "The Lobbi",
    "email": "developers@thelobbi.io"
  },
  "license": "MIT",
  "repository": "https://github.com/Lobbi-Docs/claude",
  "keywords": [
    "multi-model", "llm-routing", "model-selection", "ensemble",
    "claude", "gpt", "gemini", "llama", "mistral", "ollama",
    "cost-optimization", "latency-optimization", "capability-matching",
    "consensus", "voting", "model-cascade", "fallback", "load-balancing"
  ]
}
