{
  "name": "fixer",
  "version": "1.0.0",
  "description": "Error Resolution Engine - Diagnoses, fixes, and prevents common programming errors across TypeScript, Python, Rust, and Go",
  "author": {
    "name": "Claude Orchestration Team"
  },
  "keywords": [
    "error",
    "bug",
    "exception",
    "crash",
    "fix",
    "debug",
    "stack trace",
    "traceback",
    "panic",
    "segfault",
    "null pointer",
    "undefined",
    "type error",
    "import error",
    "module not found",
    "cannot find",
    "does not exist",
    "permission denied",
    "syntax error",
    "compilation error",
    "runtime error",
    "reference error",
    "TypeError",
    "ValueError",
    "RuntimeError",
    "NullPointerException",
    "IndexOutOfBounds",
    "KeyError",
    "AttributeError",
    "NameError",
    "why does this",
    "keeps failing",
    "keeps breaking",
    "always crashes",
    "same error"
  ]
}
