{
  "name": "documentation-orchestrator",
  "version": "1.0.0",
  "description": "Scribe - Keeper of knowledge and wisdom. Orchestrates documentation generation including API docs, README files, architecture diagrams, code documentation, and knowledge base management. Integrates with Confluence for wiki sync and Obsidian for personal knowledge management.",
  "author": {
    "name": "The Lobbi",
    "email": "developers@thelobbi.io"
  },
  "license": "MIT",
  "repository": "https://github.com/Lobbi-Docs/claude",
  "keywords": [
    "documentation", "docs", "readme", "api-docs", "openapi",
    "swagger", "typedoc", "jsdoc", "sphinx", "mkdocs",
    "architecture", "diagrams", "mermaid", "plantuml",
    "confluence", "wiki", "knowledge-base", "obsidian",
    "adr", "decision-records", "runbooks", "onboarding"
  ]
}
