{
  "name": "testing-orchestrator",
  "version": "1.0.0",
  "description": "Validator - Arbiter of truth and correctness. Orchestrates comprehensive testing including unit tests, integration tests, E2E tests, performance tests, and regression detection. Integrates with Jira for test case linking and CI/CD for automated test execution.",
  "author": {
    "name": "The Lobbi",
    "email": "developers@thelobbi.io"
  },
  "license": "MIT",
  "repository": "https://github.com/Lobbi-Docs/claude",
  "keywords": [
    "testing", "unit-test", "integration-test", "e2e", "end-to-end",
    "pytest", "jest", "vitest", "playwright", "cypress",
    "tdd", "bdd", "coverage", "mutation-testing", "regression",
    "performance", "load-test", "k6", "locust", "artillery",
    "snapshot", "visual-regression", "accessibility", "a11y"
  ]
}
