{
  "name": "database-schema-designer",
  "version": "1.0.0",
  "description": "Architect - Master builder of data structures. Orchestrates production-grade database schema design, optimization, and evolution. Detects N+1 queries, suggests optimal indexes, plans zero-downtime migrations, and ensures schemas perform at scale. Real value for real databases.",
  "author": {
    "name": "The Lobbi",
    "email": "developers@thelobbi.io"
  },
  "license": "MIT",
  "repository": "https://github.com/Lobbi-Docs/claude",
  "keywords": [
    "database", "schema", "migration", "prisma", "typeorm", "alembic",
    "sql", "postgres", "mysql", "mongodb", "index", "optimization",
    "n+1", "query", "performance", "erd", "diagram", "normalization",
    "zero-downtime", "backward-compatible", "seed-data", "fixtures",
    "foreign-key", "constraint", "trigger", "view", "materialized-view",
    "partition", "sharding", "replication", "backup", "restore"
  ]
}
