{
  "name": "langgraph-architect",
  "version": "1.0.0",
  "description": "Expert LangGraph/LangChain agent builder with MCP integration, workflow orchestration, and CLI accessibility. Creates production-ready AI agents that are reachable via command line and Claude Code.",
  "author": {
    "name": "Brookside BI"
  },
  "license": "MIT",
  "homepage": "https://github.com/Lobbi-Docs/claude",
  "repository": "https://github.com/Lobbi-Docs/claude.git",
  "keywords": [
    "langgraph",
    "langchain",
    "agent-builder",
    "workflow-orchestration",
    "state-machine",
    "multi-agent",
    "mcp",
    "model-context-protocol",
    "ai-agents",
    "graph-builder",
    "checkpointing",
    "memory-management",
    "tool-integration",
    "subgraph",
    "supervisor-pattern",
    "cli-agents"
  ]
}
