{
  "name": "api-integration-helper",
  "version": "1.0.0",
  "description": "Connector - Production-ready API integration specialist. Orchestrates 10 agents to generate typed clients, auth flows, error handling, rate limiting, and mock servers from OpenAPI/GraphQL specs. Delivers enterprise-grade API integrations, not basic fetch wrappers.",
  "author": {
    "name": "Brookside BI",
    "email": "plugins@brooksidebi.com"
  },
  "license": "MIT",
  "repository": "https://github.com/Lobbi-Docs/claude",
  "keywords": [
    "api", "openapi", "swagger", "graphql", "rest", "client-generation",
    "typescript", "authentication", "oauth", "api-key", "jwt",
    "rate-limiting", "retry-logic", "error-handling", "mock-server",
    "api-testing", "request-validation", "response-validation",
    "stripe", "api-integration", "sdk-generation", "typed-client"
  ]
}
