{
  "name": "migration-wizard",
  "version": "1.0.0",
  "description": "Migrator - The architect of transformation. Orchestrates complex code migrations between frameworks, libraries, and API versions with precision codemods, incremental strangler fig patterns, and automated transformation. Ensures zero-downtime migrations with comprehensive test coverage and rollback strategies.",
  "author": {
    "name": "Brookside BI",
    "email": "plugins@brooksidebi.com"
  },
  "license": "MIT",
  "repository": "https://github.com/Lobbi-Docs/claude",
  "keywords": [
    "migration", "codemod", "refactor", "transform", "modernize",
    "react-hooks", "vue2-vue3", "express-fastify", "angular-react",
    "webpack-vite", "jest-vitest", "class-to-hooks", "strangler-fig",
    "ast", "jscodeshift", "babel", "typescript", "eslint-codemod",
    "api-migration", "breaking-changes", "deprecation", "upgrade"
  ]
}
