{
  "name": "code-knowledge-graph",
  "version": "1.0.0",
  "description": "Librarian - The Keeper of Infinite Archives. Builds a semantic knowledge graph of your entire codebase, understanding relationships between code entities, architectural patterns, data flows, and domain concepts. Enables impact analysis, architectural queries, and semantic code search. Remembers everything about your codebase.",
  "author": {
    "name": "The Lobbi",
    "email": "developers@thelobbi.io"
  },
  "license": "MIT",
  "repository": "https://github.com/Lobbi-Docs/claude",
  "keywords": [
    "knowledge-graph", "semantic", "graph-database", "code-understanding",
    "impact-analysis", "dependency-graph", "call-graph", "data-flow",
    "architectural-patterns", "domain-model", "entity-relationship",
    "code-search", "semantic-search", "codebase-memory", "neo4j"
  ]
}
