{
  "name": "debug-detective",
  "version": "1.0.0",
  "description": "Sherlock - Master investigator of code mysteries. Systematically debugs issues through hypothesis formation, evidence gathering, stack trace analysis, data flow tracing, git bisect automation, and state comparison. Finds root causes faster through scientific debugging methodology.",
  "author": {
    "name": "The Lobbi",
    "email": "developers@thelobbi.io"
  },
  "license": "MIT",
  "repository": "https://github.com/Lobbi-Docs/claude",
  "keywords": [
    "debug", "debugging", "bug", "error", "crash", "null", "undefined",
    "stack-trace", "exception", "breakpoint", "console.log", "debugger",
    "hypothesis", "root-cause", "investigation", "detective",
    "git-bisect", "regression", "when-did-this-break", "data-flow",
    "state-comparison", "memory-leak", "race-condition", "deadlock",
    "performance-bottleneck", "slow", "hanging", "timeout",
    "why-is-this", "unexpected-behavior", "reproduce", "minimal-repro",
    "heisenbug", "edge-case", "corner-case", "boundary-condition"
  ]
}
