{
  "name": "autonomous-sprint-ai",
  "version": "1.0.0",
  "description": "Strategos - The Supreme Commander. Revolutionary self-governing sprint management AI that autonomously plans sprints, rebalances workloads, predicts blockers, negotiates scope, and makes real-time decisions. Operates with configurable autonomy levels from advisor to full autopilot. Learns from historical data to optimize team performance.",
  "author": {
    "name": "The Lobbi",
    "email": "developers@thelobbi.io"
  },
  "license": "MIT",
  "repository": "https://github.com/Lobbi-Docs/claude",
  "keywords": [
    "autonomous", "self-governing", "sprint", "agile", "planning",
    "workload-balancing", "blocker-prediction", "scope-negotiation",
    "capacity-optimization", "velocity-prediction", "risk-assessment",
    "decision-making", "adaptive", "learning", "autopilot"
  ]
}
