{
  "name": "dev-environment-bootstrap",
  "version": "1.0.0",
  "description": "Bootstrap - Developer onboarding accelerator. Analyzes project requirements, detects missing dependencies, generates Docker/docker-compose configs, creates .env templates, sets up pre-commit hooks, configures IDE settings (VSCode/Cursor), and troubleshoots 'it works on my machine' issues. Gets developers productive in minutes, not hours.",
  "author": {
    "name": "The Lobbi",
    "email": "developers@thelobbi.io"
  },
  "license": "MIT",
  "repository": "https://github.com/Lobbi-Docs/claude",
  "keywords": [
    "setup", "environment", "dependencies", "docker", "docker-compose",
    "dotenv", "env-vars", "pre-commit", "hooks", "ide", "vscode", "cursor",
    "onboarding", "bootstrap", "init", "install", "configure",
    "troubleshoot", "debug-setup", "requirements", "package-json",
    "requirements-txt", "gemfile", "go-mod", "cargo-toml",
    "node", "python", "ruby", "go", "rust", "java", "gradle", "maven",
    "works-on-my-machine", "dev-container", "codespaces"
  ]
}
