{
  "name": "git-workflow-orchestrator",
  "version": "1.0.0",
  "description": "Sentinel - Guardian of the codebase timeline. Orchestrates advanced Git workflows including trunk-based development, GitFlow, ship/show/ask patterns, branch protection, rebasing strategies, conflict resolution, and merge automation. Integrates with Jira for linked branches and smart commits.",
  "author": {
    "name": "The Lobbi",
    "email": "developers@thelobbi.io"
  },
  "license": "MIT",
  "repository": "https://github.com/Lobbi-Docs/claude",
  "keywords": [
    "git", "branch", "merge", "rebase", "conflict-resolution",
    "gitflow", "trunk-based", "feature-flags", "pull-request",
    "code-review", "branch-protection", "semantic-versioning",
    "commit-linting", "conventional-commits", "squash", "cherry-pick",
    "stash", "worktree", "bisect", "reflog", "hooks"
  ]
}
