{
  "name": "code-quality-orchestrator",
  "version": "1.0.0",
  "description": "Curator - Ancient guardian of code excellence. Orchestrates 5 quality gates (Static Analysis, Test Coverage, Security Scanning, Complexity Analysis, Dependency Health) in a unified flow. Ensures pristine code through Forerunner precision and automated enforcement.",
  "author": {
    "name": "Brookside BI",
    "email": "plugins@brooksidebi.com"
  },
  "license": "MIT",
  "repository": "https://github.com/Lobbi-Docs/claude",
  "keywords": [
    "code-quality", "linting", "eslint", "prettier", "static-analysis",
    "test-coverage", "security-scanning", "complexity", "dependencies",
    "pre-commit", "ci-cd", "quality-gates", "orchestration", "clean-code"
  ]
}
